headword, pos, vietnamese
virtuoso, noun, nghệ sĩ tài ba  
virulent, adjective, độc hại  
visceral, adjective, thuộc về nội tạng  
vitiate, verb, làm hỏng  
vitriolic, adjective, cay độc  
vituperate, verb, chửi rủa  
vivacious, adjective, hoạt bát  
vociferous, adjective, om sòm  
volatile, adjective, không ổn định  
volition, noun, ý chí  
voracious, adjective, háo hức  
vouchsafe, verb, bảo đảm  
vulnerable, adjective, dễ tổn thương  
waffle, verb, nói vòng vo  
wane, verb, suy yếu  
wary, adjective, cảnh giác  
wax, verb, tăng lên  
whimsical, adjective, kỳ lạ  
wily, adjective, láu cá  
winsome, adjective, quyến rũ  
wistful, adjective, bâng khuâng  
wizened, adjective, nhăn nheo  
wrath, noun, cơn thịnh nộ  
wry, adjective, mỉa mai  
xenophobia, noun, sự bài ngoại  
yen, noun, sự khao khát  
zealous, adjective, nhiệt thành  
zenith, noun, đỉnh cao  
zany, adjective, kỳ quặc  
zest, noun, sự nhiệt huyết  
zigzag, verb, đi ngoằn ngoèo  
zoom, verb, phóng to  
abridge, verb, rút ngắn  
abrogate, verb, bãi bỏ  
abscond, verb, lẩn trốn  
abstruse, adjective, khó hiểu  
accolade, noun, lời khen ngợi  
accrue, verb, tích lũy  
acerbic, adjective, chua cay  
acquiesce, verb, đồng ý ngầm  
acrid, adjective, cay đắng  
acrimony, noun, sự gay gắt  
adage, noun, ngạn ngữ  
addle, verb, làm rối  
adept, adjective, tinh thông  
adjudicate, verb, phân xử  
adjure, verb, khẩn nài  
adroit, adjective, khéo léo  
adulation, noun, sự tán dương quá mức  
adulterate, verb, pha trộn  
adumbrate, verb, phác họa  
adventitious, adjective, ngẫu nhiên  
advocate, verb, ủng hộ  
aesthetic, adjective, thẩm mỹ  
affable, adjective, dễ gần  
affectation, noun, giả tạo  
affinity, noun, sự đồng cảm  
affluence, noun, sự giàu có

